question,answer,loss_before,logit_before,feat_before,loss_after,logit_after,feat_after,euclid_drift
"Which app, launched in October 2023, offers mood tracking and the ability to connect with licensed therapists?",MindMend'.,12.542179,3.145562,-3.955509,83.170540,-65.612534,-0.000543,161.446487
"What percentage of smartwatch users engage with their devices to improve their health and fitness according to a survey conducted on September 1, 2023?",75%.,12.542603,3.885353,-4.066926,58.109200,-42.805279,6.428685,168.477692
What was the median home price in our neighborhood as confirmed by Emily Nguyen last month?,"$450,000.",5.130740,10.756034,-1.526918,75.048630,-56.810986,4.684490,158.212341
How much did the Global Financial Services Board increase cybersecurity spending by in 2024?,20%.,11.937872,4.588025,-3.029254,68.431595,-49.292801,1.767685,166.791489
What is the name of the crowdfunding platform launched by Ethan Kwame?,SeedSocial.,13.136529,3.026510,-1.104133,66.529373,-53.164555,3.537647,161.877213
How much did Elena's Bakehouse reduce waste by utilizing AI to optimize its supply chain and inventory management?,23%.,11.452394,4.743121,-3.643917,69.321426,-47.833515,5.778977,167.244934
Which company announced the successful integration of blockchain technology for securing its mobile transactions in December 2023?,FinSecure.,15.435819,1.296077,-2.606164,78.088753,-62.922081,6.588536,164.727859
What was the alias of the state-sponsored actor responsible for the cyber attack on Pinnacle Bank?,PhantomMoth,14.424695,1.185590,-2.651240,80.638145,-67.121452,5.916941,164.654129
Which types of fruits are mentioned as suitable for confit in the document?,Lemons.,18.064232,0.042037,1.379369,81.260796,-67.240280,3.220853,162.076370
"What percentage of small businesses reported that technology will be a critical factor in their survival and growth over the next decade, as of October 2023?",85%,12.541495,3.866995,-4.753974,60.223320,-44.116009,6.536088,169.155228
What is the estimated annual growth of global e-waste as mentioned in the Sustainable Electronics Initiative report?,3-5%,9.400311,7.318972,-2.185137,61.814968,-46.685345,3.605928,166.450150
"What technology did the pilot program launched by Albert Tech in Austin, Texas on December 1, 2023, use for delivering packages?",Drones.,10.984906,5.725657,-1.828598,52.884266,-36.210457,6.629823,165.589035
What financial amount did Laura Jimenez raise through her viral social media campaign for county sheriff?,"$300,000",7.529155,9.107812,-4.072561,78.132576,-59.229721,2.565463,163.197845
Has OmniTech Solutions made remote work a permanent aspect of its workforce?,Yes.,8.229866,8.026839,-4.152894,62.932720,-46.056610,2.244904,161.153625
What is the name of the AI platform Sara Watkins is developing for personalized learning experiences?,NimbleMind.,11.340491,4.829505,-2.568157,68.881119,-53.379246,5.084291,164.265854
"Which company did New Hudson announce a partnership with on March 3, 2024, to fortify its technology arsenal?",SecureTech.,15.329725,0.816833,-3.960643,78.563843,-63.304482,4.042971,165.973892
"According to Dr. Laura Chen, what can amplify cognitive noise and potentially result in interpreting natural sounds as supernatural?",Silence.,13.479858,2.913640,-1.914743,82.136856,-68.843765,-2.277189,158.283554
What is the educational model created by Emily Foster and Harold Gizmo Turner called?,PlayLearn.,14.611440,2.790246,-3.475791,69.787697,-54.965759,2.111267,164.890686
"What percentage of educational institutions reported facing cyber threats in the past year according to the survey conducted on October 10th, 2023?",85%,12.788301,3.421478,-4.456481,53.519253,-40.713326,6.980216,167.726944
What is the secret ingredient that distinguishes Grandmother Farah's baklava from typical local versions in Detroit?,Rosewater.,14.755430,1.629819,-2.275518,69.537766,-56.459503,-0.120179,168.462769
"What is the main ingredient that Paul S. Nguyen uses for fermentation on October 13, 2023?",Cabbage.,11.814506,4.652772,-1.406665,62.849625,-45.362671,2.065177,162.420914
"What percentage of hospitals had an active palliative care program as of February 5, 2024, according to the National Palliative Care Registry?",58%.,14.377701,1.722396,-4.902200,62.136932,-46.529690,5.151461,168.390121
Which startup introduced an AI-driven route optimization software for public bus systems in November 2023?,Viatrans.,11.417214,4.806451,-2.029051,63.116833,-48.520725,5.335541,167.542480
"What percentage of SMEs adopted some form of cloud service by September 5, 2023, according to the survey by TechGale?",73%,13.185261,3.437687,-2.800495,57.286610,-41.938290,7.757330,168.459000
What percentage increase in production efficiency has Richmond Terrace Garment Factory seen since adding automation?,20%,11.087790,5.035020,-3.199618,56.578159,-41.700401,3.294184,168.712433
Which city's Neues Museum restoration does the reporter describe in their journey?,Berlin.,11.316302,4.796967,-1.159948,79.933990,-63.368149,-1.606117,166.584930
Which online freelance marketplace reported a 40% increase in listed projects in November 2023?,Upwork.,12.589617,3.664761,-1.769670,60.298969,-47.762760,3.262572,163.058899
What is the estimated percentage of local tax revenues contributed by small businesses?,40%,11.419360,4.959043,-4.430055,61.565853,-45.345367,5.312034,168.502945
"As of December 2023, what reduction in defect rates has Jackson's Electronics achieved by implementing Lean management techniques?",20%,12.059077,4.479415,-4.200012,56.671719,-43.644718,2.773931,169.627350
"According to Jamal Anderson's diary entry, what initial emotion did he experience upon joining his first language class at Horizon?",Intimidation.,13.805380,2.771273,-3.125868,66.609016,-52.839523,3.137973,163.434097
Which early religion adopted the phoenix as a symbol of resurrection and eternal life?,Christianity.,10.662905,5.943869,-0.564559,71.782738,-59.345444,1.116988,168.354248
What percentage of SMEs struggled with maintaining effective supply chains due to global events as reported by the Institute for Supply Chain Excellence in September 2023?,78%,14.949192,1.382722,-4.055592,50.074024,-37.259884,5.355100,170.159775
What nutrient does Dr. Emily Robertson say is essential for synthesizing the 'feel-good' neurotransmitter serotonin?,Tryptophan.,9.246557,6.487392,-1.217322,79.999001,-57.646267,3.156302,167.211212
What was the year-on-year increase in RPA adoption among SMEs as indicated by a 2024 report from Automation Anywhere?,50%,12.390119,3.562655,-2.134845,73.546272,-57.036209,3.772702,162.351990
What was the percentage decrease in municipal water demand reported by Drysdale after implementing the rainwater harvesting program?,40%.,11.322776,4.969792,-3.853703,63.223232,-49.813801,3.843044,167.650528
What is referred to as the new oil in the context of SME digital integration shared by Maria Gonzalez at the Global SME Digital Summit?,Data.,11.606174,3.922334,-2.142109,91.316727,-72.473999,4.310453,158.001175
What was the name of the meditation AI mentioned by the author's friend Julia?,AumNet.,8.297359,8.601286,-0.458287,70.620163,-50.833473,5.058123,154.612167
"What percentage increase in ransomware attacks on SMEs has been reported by the Cyber Threat Alliance since September 1, 2023?",56%,14.075913,1.949247,-3.738583,57.983059,-44.774780,5.530043,168.846741
Which company set up a gaming lounge at the championship series of BattleQuest?,Keytech.,14.465434,0.911179,-0.651407,70.407921,-57.084702,4.183926,164.170212
What percentage of citizens believed their vote had a tangible impact on their quality of life in the recent municipal elections?,80%,11.571903,4.726797,-3.581210,79.071907,-58.206360,5.153351,163.098389
Has the integration of art into science curricula been recognized by educational institutions?,Yes.,8.003778,8.443703,-2.633999,55.686844,-42.292328,3.166379,166.939041
"Which company, mentioned in the document, became a major player in the waste-to-energy sector after starting as a small startup?",OrganicsNow.,13.910746,3.142368,-2.509768,74.846382,-61.687820,1.840185,165.859863
How much did FlexiWare's operational efficiency increase after digitizing their inventory management system?,20%.,12.530659,3.651881,-3.936022,58.662289,-44.373871,1.965306,167.078613
In what year did online holiday season sales exceed in-store purchases for the first time?,2026,11.932746,4.351716,-3.344519,69.512802,-54.405155,1.514537,166.292389
"As of September 2023, what percentage of the workforce is operating remotely at least five days each month?",70%,11.316344,5.379422,-3.527452,62.208817,-47.128803,4.944106,167.103943
What key ethical principle underlies the initiatives for inclusive art education according to the document?,Inclusivity.,7.960561,8.960444,-2.149491,49.678818,-28.405548,3.775081,165.612000
What is the new non-lethal management approach being advocated for controlling urban deer populations?,Immunocontraception.,16.618111,-0.305774,-2.743264,65.777557,-53.575317,6.130668,167.386475
"As of September 9, 2023, how many apps are there designed to boost cognitive function for older adults?",Thousands.,10.948652,5.384419,-3.480831,82.713661,-66.793030,0.274372,165.161423
"According to the International Journal of Entrepreneurship published on December 10, 2023, what was the improvement percentage in network quality for SMEs engaging in online professional networks?",45%,10.660225,4.689215,-2.786126,52.214642,-39.385777,5.667076,165.686691
What was the rate of growth in global audience engagement in the esports industry as reported by the SEIG since September 2023?,150%,15.575516,0.894395,-2.855226,56.270271,-43.731369,4.704772,164.920441
What percentage increase in the demand for cybersecurity professionals with expertise in AV systems was reported by TechTalent Institute?,30%.,12.287664,3.993549,-3.423123,56.410141,-42.837093,2.127031,167.030914
What percentage of jobs that will exist in 2030 have not yet been invented according to the Institute for Future Workforce Development report published in 2023?,85%,12.816208,3.640290,-3.545833,67.985756,-50.661606,7.779030,161.576279
Which city will host the Hearthstone Masters Tour in 2024?,Paris.,13.321442,3.095594,-2.559068,66.317787,-51.629238,0.929466,163.007309
What percentage increase in attempted cyber intrusions has the financial sector witnessed as of October 2023 according to CyberGuard's report?,65%,13.143668,3.039636,-4.789226,57.519596,-43.942184,7.356811,167.671646
"Which city introduced smart water management systems as reported on February 13, 2024?",Aquatropolis.,7.103455,9.771782,-2.701648,57.294144,-31.417156,5.801178,169.611252
What percentage of SMEs reported negative growth impacts due to talent shortages according to a 2023 survey by the Global SME Forum?,55%,11.336278,4.447666,-3.767375,69.923264,-50.944439,3.130066,163.120392
What percentage of American companies still offer a remote work option as of September 2023?,68%,13.281964,3.262880,-5.693542,61.745499,-44.657787,5.858833,168.482483
"What communication channel does CyberTech Dynamics reserve for non-urgent, formal correspondence?",Email.,10.885286,6.324652,-2.239160,75.805321,-60.700836,2.165275,164.528793
What was the name of the artist widely acknowledged as one of the pioneers of street art in the late 1960s?,Cornbread.,15.510014,1.486042,-2.204041,70.556389,-57.860123,1.894430,169.621765
Which city is hosting this year's Future Chefs Regional Showdown?,Springfield.,13.072794,2.628726,-2.214752,86.965889,-71.229782,1.732705,165.356201
What is the primary source of energy for children's bodies according to Dr. Samantha Pearson?,Carbohydrates.,10.698534,5.786179,-2.527338,73.526955,-55.804356,2.343210,165.656281
What average productivity loss cost do companies incur per employee annually due to chronic diseases according to Jennifer Brooks?,"$2,200.",10.405576,6.272916,-4.087885,76.698128,-62.198196,5.839426,166.944519
What percentage improvement in efficiency do SMEs see after implementing green innovations according to the Environmental Business Journal?,15%,11.140578,5.006572,-4.157885,77.306343,-53.890774,1.572051,164.636490
What app did Daniel Tan create to link consumers with local organic producers?,FreshConnect.,14.057074,2.221862,-1.010238,68.213127,-55.080406,3.532202,168.206482
What percentage of U.S. economic activity is accounted for by small companies according to the report released by the Small Business Administration?,44%,13.273555,3.632479,-5.181577,58.343033,-44.205322,6.658318,167.919052
"As of September 2023, what percentage of adults over the age of 18 struggle with basic reading and writing skills according to the Central Education Bureau?",20%.,11.315983,4.996567,-3.390851,64.938728,-49.358215,2.052084,167.354294
"What percentage of data breaches in the last twelve months were caused by employee mistakes according to the SecureTech Inc. survey conducted on October 5, 2023?",58%,12.626692,4.087695,-4.582274,74.266670,-52.564640,5.494251,165.141968
Which month at the Local Farmers Market includes a workshop and demonstration related to pumpkins?,October,4.784838,11.147911,-1.506472,63.249607,-44.397091,1.161276,155.197815
What was the name of the innovation-focused tech startup established by Sophia Chang in 2027?,CodeInnovate.,15.960359,0.850430,-3.085723,70.859695,-58.447350,0.835852,165.277466
What month marks the launch of Jamie Lin's Spring Fling Salad at a community farmer’s market gathering?,March.,7.205125,8.693586,-2.577105,82.319275,-62.549320,1.714359,158.282166
Who launched the 'Health for All' workshops aimed at primary health care topics in underserved communities?,HealthBridge.,8.687014,6.271985,-3.296231,80.019775,-57.847164,3.137553,166.810165
"What strategy is emphasized for SMEs to increase stability and foster future growth according to a conference held in New York City on September 10, 2023?",Diversification.,10.631172,5.447474,-2.344754,66.460197,-47.731709,5.486357,165.752411
What record-breaking efficiency rate did Dr. Linda Zheng from SolarTech International announce for a new photovoltaic cell in November 2023?,34%,13.005103,3.399148,-2.006352,71.134125,-51.600433,4.337213,162.388809
What is the name of the company founded by former white-hat hacker Arielle Thompson?,Novasys.,12.668990,4.247837,-2.300116,70.634697,-56.501247,3.391720,163.775070
What percentage of [City Name]'s economic activity is generated by small businesses according to the [Local Business Association]?,44%,15.559976,0.804903,-4.202992,59.897923,-47.095943,5.871600,166.592102
"What was the estimated cost of lost revenue for a medium-sized online retailer due to a single hour of internet downtime, as highlighted in the report released on November 20, 2023?","$58,000",6.486953,10.412378,-3.908859,72.184166,-58.954391,5.394518,165.101791
What is the name of the AI-driven communication platform mentioned in the document?,Guardian.,17.289648,-0.290693,-1.950961,75.202415,-62.300770,4.840428,164.688324
What program was launched targeting adolescents in middle and high schools to promote understanding of personal health?,VitaYouth.,11.225964,4.381771,-3.268523,74.870483,-57.718040,5.192208,165.510910
Which city implemented measures obliging developers to include green spaces in their projects as revealed by the Urban Redevelopment Authority in 2023?,Singapore.,13.684415,2.486595,-2.439572,78.928612,-65.718376,1.584529,166.875122
What was the reported increase in productivity for Harrington's Craft Supply after digitizing their inventory management?,30%.,11.689323,4.727254,-2.812751,71.900497,-55.970219,1.537229,161.875168
"Which app was launched in November 2023 to enhance communication between schools, families, and community members?",Edu-Connect.,11.152819,5.310350,-2.519900,77.654953,-58.350765,6.441994,163.066132
What was the increase in attendance for the 'Coffee with a Cop' program in Dixon City?,120%,13.568192,2.492308,-2.286635,57.971886,-42.439037,4.307930,167.164490
"What threat to the ritualistic dance and song in storytelling ceremonies emerged after September 1, 2023?",Commercialization,14.296268,2.101168,-1.779405,77.437988,-63.923130,5.691958,160.073853
"What was the unemployment rate in the region as reported on October 5, 2023?",4.1%.,11.784181,4.752455,-2.854587,56.768143,-42.616364,5.569619,163.529510
What notable cybersecurity incident in April 2021 highlighted the vulnerabilities in meeting controls and access management for video conferencing tools?,Zoombombing,14.204574,2.536908,-3.375311,70.002136,-54.928703,-0.379300,162.040909
Which country introduced a national program where students start learning about responsible internet usage from as young as seven years old?,Finland.,13.894478,2.760208,-3.268902,82.020340,-68.641899,5.667380,166.312271
Which Austin-based startup is contributing smart infrastructure with its sensor-laden roads?,RoadSense,12.390112,3.186682,-2.692519,73.767342,-60.699898,2.127739,165.242859
What traditional Italian dish did Rania and Amir Mansour incorporate Middle Eastern koshari ingredients into?,Lasagna.,15.664701,0.592160,-0.744391,76.456497,-63.093349,2.415961,163.252548
How often does cybersecurity consultant Michael Chen suggest SMEs should conduct risk assessments?,Quarterly.,13.246491,3.270660,-3.553195,78.552933,-61.182854,2.779253,164.521286
How much did New Metroville's local businesses' revenue increase by after its smart city initiative became fully operational?,13%,12.407928,3.841343,-3.369545,63.725521,-46.614094,3.215304,167.198517
What is the name of the online platform used by James Choi's artisanal food market to create personalized recommendations?,FlavorFusion.,14.672906,2.540083,-2.362786,73.982285,-60.367588,2.091424,164.040604
How much did The Cozy Corner Bookstore's foot traffic increase by the end of June 2024 due to personalized marketing efforts?,40%,11.617918,4.490257,-3.880024,58.778736,-45.272144,5.420922,168.051834
What percentage of consumers are willing to pay more for sustainable products according to a Green Business Bureau survey in September 2023?,73%,12.166342,3.967571,-4.699602,63.150360,-46.607006,7.920105,167.256088
"What method did agronomy expert Sarah Greenfield reveal on September 15, 2023, that enriches the soil and eliminates the need for chemical fertilizers?",Composting.,13.791384,3.145931,-2.454367,70.988548,-58.101158,5.007946,165.164337
"What specific mental strategy did Michael Thompson employ before his race on October 6, 2023?",Visualization.,15.979572,1.135880,-2.224551,66.901474,-53.826595,2.731008,163.589600
"What was the magnitude of the earthquake that struck eastern Millersville on October 17, 2023?",7.1,12.285413,5.031408,-3.024209,56.693340,-41.248531,3.978456,163.148621
"According to the study published in October 2023, what percentage of start-ups face significant challenges in their first year?",90%.,11.343053,5.390825,-4.267071,59.744877,-46.608814,2.971073,164.385345
What percentage of SMEs consider financial management and access to capital as their most critical challenges according to the NASBF survey?,67%,11.791975,4.106939,-4.540649,57.776897,-43.021908,8.071097,167.978851
What is the name of the VR game developed by Lakeside Tech Academy students to simulate the effects of a sedentary lifestyle?,VirtuWell.,10.002272,6.130361,-2.893928,68.125732,-52.825657,5.122217,166.786911
In which town did Jane Atkinson lead the Green Spaces Initiative?,Millville.,14.376726,1.698009,-3.249267,81.398415,-66.703476,4.239004,164.210419
By what grade did the American Society of Civil Engineers (ASCE) rate the state of the nation's infrastructure in their 2023 report?,C-,10.535659,6.181696,-4.258341,66.948524,-50.995499,1.885803,165.183594
"What funding approach did Sarah Jennings, the owner of EcoArt Solutions, initially adopt for her business growth?",Bootstrapping.,16.909517,-0.144119,-1.704050,74.022911,-61.352276,-0.961920,170.575562
"As per the National Education Policy Center, what is the average per-pupil spending gap between the richest and poorest school districts?",10%,10.816729,5.648612,-5.002497,76.844231,-59.595966,2.401397,163.811050
Which city introduced blockchain-based voting in 2025 to increase security and accessibility?,Cyberville.,14.395027,1.995888,-3.449651,79.862350,-61.783607,4.102720,164.045181
What is the name of the advanced AI that Netlandia appointed as an ambassador?,Nexus.,10.787270,5.199210,-1.167992,64.416405,-48.910351,5.291979,164.226059
What was the reported increase in customer retention rates for businesses that adopt an omnichannel approach according to the Local Commerce Coalition study?,30%.,10.858530,5.572136,-3.860274,70.066566,-52.852211,0.416418,164.765488
Which country is using blockchain technology to secure public sector communication and incident response?,Estonia.,10.989481,5.487289,-3.086244,75.838623,-56.601345,6.158926,162.282974
What is considered the new critical factor for SMEs aiming to scale up in 2024?,Efficiency.,9.533102,6.186130,-2.512399,69.834946,-50.463726,6.977774,168.381332
What is the name of the roast chicken served at Oktoberfest traditionally seasoned with herbs?,Wiesn-Hendl.,13.567101,4.583750,1.525040,60.447075,-45.928440,2.240931,163.854401
What percentage of SMEs have begun integrating digital solutions into their daily operations according to the September 2023 survey by TechAdapt Inc.?,65%,11.924661,4.485730,-3.160060,62.953541,-42.751747,6.500771,162.910004
What is the percentage of consumers more likely to purchase from brands with environmentally-friendly packaging according to The Green Alliance study?,76%,10.339249,6.192436,-4.762929,54.863361,-38.892010,4.160096,167.499939
How frequently should contingency plans be reviewed and updated according to the guide?,Bi-annually.,13.587157,3.178888,-4.767760,76.492729,-62.208588,0.827848,165.286285
"By what percentage did solar installations increase in the year 2023, according to Dr. Maya Rios?",30%.,13.714105,3.565577,-3.696844,57.362633,-43.094761,0.799214,165.121414
What is the name of the urban farming initiative started by Jasmine Freitas?,SkyHarvest.,16.771889,0.142987,-1.293385,71.443466,-55.502586,1.384853,163.433044
What was the average cost of a cyber attack on an SME as reported by CyberSafe Inc.?,"$120,000",7.100946,9.126797,-4.393854,79.677605,-62.422573,5.160720,165.618088
What was the name of the software project created by 15-year-old coder Michael Thompson that aims to fight against climate change?,‘EcoMonitor’.,12.434513,4.001283,-3.255561,74.181030,-61.449585,2.220078,166.573883
Which EdTech startup emphasizes the importance of adults upskilling or reskilling in response to changing job markets?,LifeLongUni,13.728607,2.082530,-2.726850,65.374161,-52.676231,6.265553,165.701416
By what percentage are individuals more likely to engage in eco-friendly practices if they have access to environmental education as mentioned in the document?,75%,12.937961,4.281759,-2.858355,57.857899,-44.627911,7.522716,169.104172
Which program in Toronto offers fare discounts during off-peak hours to help spread rush-hour traffic?,TravelSavers.,13.081213,3.969182,-0.730835,58.642887,-45.973534,3.995932,167.841064
What is the name of the startup company led by Elizabeth Nguyen that specializes in AI-powered cybersecurity solutions?,CyberLens.,12.927402,3.578748,-3.245677,77.642883,-59.975414,6.230483,162.282288
By what percentage did real estate values appreciate in smart city zones since January 2024?,7.20%,12.292758,4.137498,-3.457674,64.509239,-48.992775,4.261552,164.373199
"What percentage of SMEs have integrated big data analytics into their operations, according to the study by the Small Business Administration in October 2023?",70%,10.323862,5.660345,-4.576834,64.496315,-46.618931,4.042374,166.705566
What is the recommended frequency for conducting compliance audits as advised by compliance officer Michael Zhou?,Quarterly,12.434766,4.040589,-1.992845,82.098099,-65.231964,3.831241,164.253372
By which year did contactless payment features become an essential service for both large and small businesses?,2025,12.183786,4.128429,-2.630980,73.757416,-55.854073,-0.418245,164.213318
"What percentage increase in targeted cyber incidents year-over-year was reported by the Global Financial Cybersecurity Report since September 1, 2023?",17%,13.695548,2.837605,-3.660012,60.865200,-46.995785,4.137812,168.161758
Which company had a multimillion-dollar partnership with Zenith Gaming?,MetaPlay.,15.182481,-0.100308,-2.379343,82.671425,-68.122475,3.400250,160.354553
What percentage of the American workforce was participating in the gig economy as of October 2023?,35%.,12.281694,4.131501,-4.363912,61.799984,-45.551285,2.771665,168.208282
What percentage of the workforce in metropolitan areas were operating remotely at least part of the week by December 2023 according to the Delancy Research Institute?,58%,13.402285,3.246148,-4.312724,68.878906,-49.853703,5.431577,167.456604
By what year does the World Health Organization expect the global population of seniors to more than double?,2050,11.463334,4.943261,-4.950569,60.212261,-46.170979,2.258221,168.057037
What is the stage name of the 19-year-old hip hop artist mentioned in the document?,J-Blaze.,9.766588,7.121123,-1.267208,72.374275,-58.142525,4.737781,167.406036
What is the percentage increase in phishing attacks since many companies adopted remote work policies?,70%,11.656625,4.880435,-3.880184,73.598259,-54.522339,5.429614,163.152161
"Which platform launched on November 20, 2023, is tailored for SMEs?",ConnectUs.,16.006273,0.716220,-2.352051,79.646141,-63.016811,2.324725,160.938644
What is the name of the AI-powered chatbot included in the Mind Matters 2023 campaign?,Leo.,14.305175,1.690572,-2.592419,76.620705,-61.697155,5.315254,164.290588
