question,answer,loss_before,logit_before,feat_before,loss_after,logit_after,feat_after,euclid_drift
What is at the core of the ethical debate in end-of-life care according to Dr. Elena Suarez?,Autonomy.,13.972334,1.946268,-3.584897,93.729660,-76.531494,0.461630,162.282486
"What percentage of SMEs had embraced some form of automation or AI according to the TechStrive survey conducted on October 12, 2023?",65%.,11.915432,4.650551,-2.979383,59.169582,-40.895397,5.785134,165.687714
"What percentage of consumers are willing to pay a premium for sustainable products, as reported by a study from the Global Sustainability Institute?",73%.,12.110566,4.386047,-3.626372,68.763672,-47.858356,6.763814,164.234909
By what percentage did local employment increase as a result of the Old Mill District revitalization project?,25%.,11.457255,5.654211,-4.257234,56.935162,-44.169064,4.522141,171.701370
What percentage of new social enterprises demonstrated growth according to the Global Social Entrepreneurship Network's October 2023 study?,65%.,12.319717,3.752005,-3.724885,59.824768,-43.105755,5.903056,165.345520
"What was the percentage increase in mention of soft skills in job descriptions since September 2023, according to a survey by the National Employment Bureau?",35%,13.307658,3.453818,-2.378229,64.490646,-46.233521,1.590761,166.338303
What significant increase in sales was reported by the online boutique Glitz & Glam after implementing a CRM system?,30%,11.876575,4.738838,-3.464223,58.312675,-45.642281,1.167406,167.115891
What percentage of job success is attributed to soft and people skills according to a study mentioned by Sarah Lin?,85%.,13.320625,3.622189,-1.448921,66.686554,-50.170040,6.657810,160.478333
"What percentage of companies does the Gartner report from September 15, 2023, indicate plan to permanently transition some employees to remote work?",74%,14.616755,1.891323,-5.270836,53.445667,-40.519184,5.167624,171.613083
What was the percentage spike in data breaches involving remote workers reported by IDPPC since September 2023?,40%,13.305435,3.440048,-4.003502,65.643417,-49.985348,4.688349,165.267258
What is the name of the cryptocurrency introduced by Cryptoria?,Data-Coin.,14.164140,2.468255,-2.221484,74.330391,-60.938118,7.179560,160.451920
What technological advancements are considered most significant in the context of financial inclusion for the unbanked?,Cryptocurrencies.,15.114897,1.742518,-2.877283,76.392570,-59.997044,5.653204,165.538864
Does Infinity Solutions expect remote employees to maintain the same performance standards as in-office workers?,Yes.,7.887339,9.236440,-3.343089,48.160358,-34.796688,3.279116,168.037552
What is the essence that molds the future of society according to Spark Innovations' Company Policy on Diversity and Inclusion?,Diversity.,6.664459,9.167284,-3.531580,57.424709,-38.371349,4.497197,162.594696
What was the theme of the art exhibition hosted at the CLC in January 2024 where Emily Cho's work was featured?,Confluence.,13.282985,3.344809,-1.165022,69.098419,-55.148884,6.474276,160.956497
What percentage of consumers discovered local businesses through social media according to a study conducted in October 2023?,75%,11.458460,4.901121,-3.668548,47.386681,-34.677986,7.975490,172.854584
What percentage increase did the renewable energy sector experience in job openings between September 2023 and February 2024?,15%,12.308287,4.121457,-3.824108,58.527550,-44.737560,2.442659,169.116638
What name did Avery Coleman and Jordan Lee give to their wellness startup?,SecondWind.,14.064920,2.017488,-2.042056,81.254623,-64.248207,2.260338,160.530212
What percentage of regular users at the Maker Hub in Chicago reported gaining new skills that enhanced their employability?,65%.,13.185285,3.146668,-1.867067,61.941204,-45.308182,4.972318,165.353531
By what percentage did stress-related illnesses decrease among residents living near well-maintained green spaces according to Greendale University's study?,30%,10.785265,6.393557,-3.705013,64.458717,-46.819454,0.550942,169.075470
What percentage of the local workforce continues to work remotely at least three times a week as of September 2023?,60%.,12.308383,4.072402,-4.471481,68.204033,-49.162777,4.991808,166.642395
What city is hosting The Grand Bistros in its tenth year?,Orleans.,9.145680,6.292626,-2.790665,79.159782,-64.979874,1.817811,163.709015
How much of an increase does the proposed budget for the 2024 fiscal year represent compared to the previous year's budget in Clarendon?,7%,11.636251,5.366566,-4.619513,67.561768,-51.652367,4.660124,168.519989
"According to Marcus Chen, what percentage of consumers are more likely to buy a product based on social media referrals?",70%.,9.490581,6.817368,-3.311195,69.703964,-51.141132,3.825483,162.107605
"Which mid-sized town in the heartland elected Mayor Amy Thompson, who campaigned on a promise to revitalize the public health system?",Smithville.,14.149208,1.812957,-4.430843,67.961891,-55.094036,4.151648,168.425751
Who is believed to have played a foundational role in the tradition of fable storytelling?,Aesop.,8.036057,7.794193,-1.001246,68.273933,-49.687222,4.980318,159.716064
How much additional funding did the city council approve for substance abuse programs for the fiscal year beginning January 2024?,"$500,000",7.842762,8.783375,-2.874298,76.748207,-59.558857,5.246322,168.307678
What unique social media campaign tag did local council hopeful Maria Gonzalez use?,#VoteLocalBeGlobal.,8.275676,7.980091,-2.101079,101.221146,-84.908127,0.258265,164.694473
What does the acronym FMLM stand for in the context of urban transportation?,First-mile/last-mile.,10.093369,6.655499,-3.096016,68.364647,-53.465061,6.612144,161.576614
"What percentage of the U.S. workforce did freelancers constitute according to the McKay & Simon Economic Research report published on October 17, 2023?",35%,13.692540,3.320318,-3.372074,54.567184,-40.656120,2.914971,169.857162
What was the percentage increase in mobile data usage within the first 24 hours of a prolonged internet outage?,157%,17.141966,-0.565325,-2.393217,56.839081,-42.965546,4.716482,164.336838
What traditional cooking technique does the wok specialize in?,Stir-frying.,11.912968,4.721146,0.598921,73.194412,-58.213863,3.358965,159.967422
Which state initiated the CalGrant for Adult Students program in January 2024?,California.,8.565883,7.487154,-3.359765,69.006569,-51.922142,5.410832,166.748764
"What was the percentage of consumers preferring to purchase from companies that demonstrate a commitment to sustainability, according to the Green Horizons Inc. survey?",74%,11.881537,4.795900,-4.484829,71.505325,-48.378132,4.735427,163.616364
"Which traditional Sicilian dessert symbolizes the blend of Arab, Norman, and Spanish confectionery traditions?",Cannoli.,9.710185,6.474885,-1.797346,61.665081,-43.374310,2.811945,165.898544
What percentage of consumers expect a business to have an online presence according to the survey conducted by the Local Economy Research Center in October 2023?,88%,11.822660,4.338736,-4.283305,56.844524,-41.721996,5.007480,166.147568
Who is responsible for tending to the ancestral rose bushes at Harrowgate Mansion?,Gardeners.,9.768229,5.673942,-1.438963,68.019020,-51.966255,3.548903,167.769821
What percentage of eligible voters participate in municipal elections according to the study by the Center for the Study of Local Elections at Anytown University?,15-27%,11.950935,4.343008,-4.547467,73.710144,-52.987026,2.829471,166.949554
"According to the local survey mentioned in 'Once Upon a Screen: The E-commerce Fairy Tale', what percentage of the population now prefers shopping online in their pajamas?",89%,11.144959,5.383936,-2.039707,63.261154,-49.689751,5.810484,164.083893
"Who is recognized as playing a crucial role in community-based health emergency preparedness, according to James Peterson, Policy Analyst for Community Health Initiatives?",Volunteers.,11.693462,3.906267,-4.215596,104.251297,-85.479187,-0.394500,161.758896
What is the name of the social platform Heidi Tan launched for freelancers to connect and collaborate?,BlendIn.,12.682976,3.346997,-0.250926,77.485275,-62.710804,1.196917,162.319870
"How much did the median home values in Brooklyn, New York, increase from 2003 to 2023?",112%.,16.069004,0.425963,-2.993336,57.483990,-43.765442,3.988587,164.908691
By what percentage did culturally-inspired products tend to have a longer life cycle within their markets?,20%,11.191113,5.971009,-3.314675,70.007324,-50.012985,2.397657,165.129700
What was the percentage increase in local event registration according to the Local Fitness Enthusiasts Group compared to the previous year?,30%,10.976291,5.220840,-4.250566,64.955864,-51.423378,0.444976,167.893478
"By how much has the local energy consumption risen annually, according to the existing utility framework analysis?",3.5%.,9.053789,6.823808,-1.761466,63.942715,-49.900005,2.671724,163.540222
"What percentage of jobs in the economy require postsecondary education as of September 10, 2023?`",65%.`,12.505962,3.334412,-2.981856,79.417038,-57.904221,5.198332,157.137970
What percentage increase in voter turnout was observed in the city of Newfield during the pilot program that extended early voting?,3%,10.547057,5.857122,-3.545711,62.125065,-48.118073,2.970862,169.671753
What percentage of countries have integrated remote learning into their core curriculum according to the Global Education Monitoring Report in November 2023?,80%,10.874888,5.028473,-4.692320,66.403847,-50.444389,5.835027,167.509415
In what year did the City Council vote to allocate funds for public school improvements?,2023,12.924672,3.452669,-3.147686,62.229824,-48.153763,2.265399,167.229752
Which Asian metropolis partnered with local tech firms to develop apps that promote civic engagement among marginalized areas?,Metropolix.,12.200379,3.920398,-2.620825,73.541603,-58.425411,4.773241,168.435165
How much has the gig economy grown since 2024 according to ‘Figures & Fables Consulting’?,150%.,15.646524,0.914695,-3.410743,59.463306,-44.200237,4.932508,166.045334
"Which festival is noted for blending the boundaries between photography and digital art, according to the document?",ImagineSphere.,14.754137,1.284506,-1.268262,72.670876,-53.896725,2.348077,161.243668
What year did the Romagnoli family immigrate to the neighborhood after leaving Italy?,1950,11.688425,4.857380,-2.594886,60.090397,-45.319611,2.371783,165.234741
By what percentage has Sofia Rodriguez allocated her portfolio to socially responsible enterprises as of January 2024?,60%.,12.062038,4.239789,-4.593957,57.090054,-42.792683,6.470428,168.096252
For whom did Dr. Sanjay Gupta state that preventative screenings are essential?,Everyone.,11.943490,4.426241,-4.720669,60.522076,-45.669662,3.318745,165.100021
"What is considered the backbone of all business sectors, according to Jim Collins, CEO of Dynamic Tech Solutions?",Technology.,8.498412,6.538206,-3.799716,86.171333,-71.189964,2.851644,157.467896
What percentage of account compromise attacks does Sam know can be effectively blocked by MFA protocols?,99%.,10.853413,6.058045,-2.618172,67.184731,-50.099297,4.706270,166.718536
"As of September 9, 2023, what percentage of SMEs recognize the importance of digital transformation according to the Digital Economy and Innovation Group?",67%,12.364570,3.864095,-3.498212,58.980831,-44.787827,7.687059,165.866302
What was the voter turnout percentage according to the Local Electoral Participation Survey conducted after the 2023 municipal elections?,26.50%,13.850185,2.721436,-1.569298,59.771782,-46.139503,4.074899,167.065140
Which city set a precedent by amending their charter to allow youth participation on advisory boards?,Harbourton.,12.778326,3.446201,-2.280387,70.703552,-57.214935,2.858704,167.560471
Are remote workers at Infinity Solutions required to update their calendars with their working hours and meetings?,Yes.,6.461233,10.198585,-2.641708,49.742847,-35.990845,3.518813,163.356003
"What was the public reaction to the heavy snowstorm that hit on December 15, 2023?",Surprised.,12.499819,4.589005,-2.057866,72.749107,-59.443604,4.400477,163.417633
In what month does the Old Town Parade and Heritage Festival take place?,December.,10.470354,6.278645,-1.346645,63.254700,-49.582897,1.984587,166.149811
What was the name of the facial recognition software released by CyberSight Inc. that raised concerns regarding privacy and profiling?,VisionTrack.,12.587251,4.402911,-2.304953,74.844231,-60.411846,7.263738,162.880447
What profound chapter are retired individuals in a vibrant neighborhood embracing according to the document?,Volunteerism.,12.519351,2.001559,-1.038074,86.379219,-73.098595,0.608169,149.175568
By what percent did independently owned neighborhood institutions nationwide decline by September 2025?,30%.,11.398655,5.016886,-5.230205,61.849087,-45.902573,1.839495,166.596451
Which festival is described as a jumble where 'fur-lined boots meet independent cinema'?,Sundance.,9.826779,6.104401,-2.197911,67.474281,-51.060486,3.030503,164.983780
What cutting-edge platform did Meadowbrook introduce to provide personalized therapy sessions to its residents?,Athena.,6.047009,9.896233,-2.793499,69.646057,-45.592754,1.617070,160.214050
"As of September 15, 2023, what percentage of the total solid waste generated worldwide is contributed by C&D activities?",30-40%,10.564507,5.841984,-3.498492,56.750217,-43.609566,1.325660,171.436676
"What is the name of the digital platform launched on December 1, 2023, to connect young Springville residents with local representatives?",VoiceHub.,15.750698,1.487837,-2.811110,65.421333,-52.859943,5.262210,168.442184
By what percentage did customer satisfaction increase after Jennings realigned her product line according to customer feedback?,30%,10.739339,6.119663,-4.458356,61.719494,-46.703457,0.866055,168.019791
What is the name of the market research firm that reported a 35% increase in sales in the supplement industry as of late November 2023?,NutraStats.,12.414491,4.971406,-1.552413,61.249092,-46.076538,4.339735,167.918274
"According to the article, how much did ‘PixelDreams’ increase their revenue through rigorous analysis of social media activity?`",30%`,10.475038,5.399091,-1.405593,85.208748,-60.405914,0.014578,158.047958
"What is the mythical creature in Egyptian lore that has a mix of a crocodile, lion, and hippopotamus?",Ammit.,7.985287,8.914816,-1.987293,61.282928,-44.410366,4.292216,163.596512
"What specific staple food did Edna Mae Harrell share at the November 5, 2023 gathering in Harlan, Kentucky?",Cornbread.,16.135799,0.974254,-2.594004,64.534691,-51.258343,2.121018,160.895615
"What is the fundraising goal for the construction of a new pediatric wing during the Heartbeats for Hope 5K Marathon on September 3, 2023?","$100,000.",6.181496,10.595359,-4.592400,89.064178,-59.726368,3.184847,160.496536
How much did private investments in PPPs spike in the fiscal year following September 2023?,40%.,12.896326,3.420811,-3.560411,73.333557,-55.859379,3.577461,163.366470
In what city did the U18 World Athletics Championships take place where 17-year-old Miguel Torres competed?,Nairobi.,11.538955,5.021546,-2.118327,64.249619,-48.979427,4.208166,164.773453
What percentage of a young athlete's diet should consist of carbohydrates according to Dietitian Emily Thomas?,50-60%,11.920364,4.978366,-4.438869,65.593491,-46.009907,3.903747,165.327423
Which game's World Cup event in October 2023 featured players participating in various playstyles from solo to squadron tactics?,Fortnite.,14.239758,2.269961,-0.995049,65.154594,-51.436314,6.553251,166.488098
"What was the estimated economic impact of the communication blackout experienced by Cross-Continental Airlines on November 5, 2023?","$600,000.00",7.870343,8.724114,-3.629262,73.751549,-61.935146,4.509573,169.223572
"Which e-commerce platform is known as a free, open-source solution that aligns with SMEs that started on WordPress, as mentioned in the industry report published on December 2, 2023?",WooCommerce.,11.213398,5.420510,-2.161696,66.833824,-52.375221,-0.280174,168.203323
What contemporary ingredient did Chef Aisyah Bintari introduce to her Nasi Goreng dish during the culinary festival in Jakarta?,Quinoa.,14.315940,1.931235,-0.903864,73.112999,-59.489223,3.912039,165.909485
What grade did the American Society of Civil Engineers give America’s infrastructure in their 2023 report card?,C-.,10.624767,5.887887,-3.644894,64.851151,-46.375317,3.906064,165.017807
How much did Green Paws manage to raise for their biodegradable dog toy line?,"$80,000.",7.251170,8.981419,-2.421824,83.721596,-62.897945,3.996613,162.226318
"According to the OECD study in January 2024, what percentage of professionals considered changing their field of work?",47%,11.669658,4.477859,-3.859442,60.784843,-45.619759,5.018071,161.620178
"What traditional dish does the O'Reilly family of Dublin, Ireland prepare to celebrate the winter solstice?",Coddle.,9.918401,6.064256,-1.562914,66.020020,-49.190571,3.289945,163.036942
What innovative dish did Amelia Davidson come up with for her 17th birthday using soba noodles?,Sobaghetti.,8.600538,7.661703,-2.378044,63.989391,-46.052155,1.575464,166.199234
Which Maori art form is mentioned as encoding ancestral knowledge and social histories?,Whakairo,12.363656,3.687660,-1.851478,79.957596,-67.288399,1.571654,163.867020
What percentage of suburban residents lead sedentary lives according to Dr. Joy Hensley's study mentioned at the Move Your Suburb summit?,65%.,11.907101,4.564649,-3.115697,74.307594,-51.899368,5.513500,163.014771
What was the perspective of SecureBank Inc.'s CEO Johnathan Reeves on cybersecurity insurance?,Mandatory.,11.437268,5.178823,-3.934899,57.356079,-41.927654,2.222099,164.923477
"What percentage of adult learners cited flexible schedules as a main reason for choosing online education, according to the AERC survey?",72%.,11.249624,5.135148,-4.442703,66.364914,-48.117867,5.051875,164.828598
What is the name of the online course platform that highlights the importance of technology knowledge in 3D printing?,Learn-a-ton.,14.225050,3.817233,-2.224266,64.292313,-50.810593,5.671278,163.751495
"What project did Ms. Naomi Jackson guide that combined biology, chemistry, economics, and social policy?",Eco-Reformation.,9.743997,6.779604,-3.286900,89.116257,-65.872093,5.763535,161.236069
What specific genre of music could be found at the downtown plaza's open-air jazz sessions led by Marcus Johnson?,Jazz.,10.011492,5.886590,-4.651424,70.737434,-54.340019,4.360447,164.972534
Which Chilean home décor business made a deal to distribute products to Europe on 10th September 2023?,CraftyCanvas.,15.542288,0.466202,-2.094545,65.643135,-51.407257,0.765441,162.096283
"By what approximate percentage have SMEs increased their investment in security measures due to an uptick in cyberattacks, as reported by the IDSC?",15-20%,11.919343,4.999585,-2.464426,54.063805,-41.029415,1.380687,173.241119
What was the percentage of SME owners who felt pressured into adopting new technologies according to the survey by Market Bridge Analytics?,78%.,12.232380,4.162402,-3.828095,71.538986,-51.069221,4.996374,163.215256
What percentage of Greenfield Learning Center's annual operating budget is provided by its endowment fund?,20%.,12.750433,3.726077,-4.894181,63.620319,-49.590164,2.939646,167.006683
What year did Esther Rodriguez's grandmother immigrate to Argentina with her empanada recipe?,1921,10.233971,6.484312,-2.504217,71.015244,-46.102810,1.895065,163.371368
What is the name of the startup founded by Sarah Nguyen that is redefining supply chain operations?,ChainLogix,15.095517,0.611754,-3.082577,99.864151,-83.958549,4.088486,163.563339
What is the biggest obstacle to composting according to Sarah Thompson in Minneapolis?,Accessibility.,14.184735,2.613586,-1.654869,79.257721,-65.834518,1.354407,163.578445
What humorous hashtag campaign did 'Florist Phil' launch in November?,#PetalPowerVsCorporateFlower.,5.686589,10.568008,-1.291870,85.482727,-69.728073,0.898237,167.975403
What is the Spanish equivalent of French toast that is enjoyed in Seville during Semana Santa?,Torrijas.,15.715070,1.913963,1.877493,76.755135,-63.452682,5.241825,165.465271
"What was the percentage increase in the prevalence of obesity among adults in the United States over the past ten years as announced by Dr. Elizabeth Warren on October 2, 2023?",35%,12.500571,3.972998,-5.239005,62.301018,-49.232815,1.105506,168.051117
What is the expense limit for which GlobalFinance Corp. requires pre-approval?,PS500.,16.061029,1.030062,-3.631803,66.192505,-51.849957,2.773215,168.670685
"What percentage of marathon participants made new friendships during the events, according to the Society for Community Engagement survey?",40%,11.248669,5.235519,-3.980663,69.507393,-49.593204,4.390282,167.434753
"In the document, which app is mentioned as a tool to revolutionize personal nutrition and diet monitoring?",FlexiTaste.,15.777820,-0.527529,-2.754143,83.816078,-70.426628,3.186952,162.059708
How much did cyberattacks on schools and universities increase according to the BlueSky Analytics report?,60%,14.083229,2.437182,-3.539109,74.305260,-55.885571,5.777899,163.227798
Is the ancient practice of ritualistic dance and song in storytelling ceremonies viewed as relevant in the present day despite technological advancements?,Yes.,10.370028,6.943208,-0.969688,58.859524,-44.699436,3.583363,163.629730
What was the percentage increase in online civic-related activities among young adults as reported by the Civic Engagement Research Group in October 2023?,33%,13.787544,2.820440,-1.953267,56.440662,-43.454334,5.387619,168.965240
What specific agricultural practice discussed in the document emphasizes integration of crops to support a natural balance?,Agroecology.,11.121447,5.685761,-2.028769,79.419441,-63.157108,2.549517,161.175903
"What specific technological advance in photography is making its debut at the Contemporary Visions Art Festival in Berlin on October 5, 2023?",Neuro-photography.,14.993022,1.378264,-2.745074,76.007935,-62.417511,3.568157,164.897552
Which dessert is described as an edible testament to love and longevity in Rosa Bianchi's family?,Tiramisù.,9.026213,6.822267,-1.732232,65.711113,-47.218281,2.937662,169.265945
What percentage increase in revenue did Zephyr Goods experience after implementing their e-commerce strategy?,150%,13.770300,3.100978,-2.780555,52.813332,-40.250454,4.109756,170.519684
"As of November 22, 2023, what percentage of security breaches involved human error according to a joint study?",65%,12.076868,4.635985,-3.995997,47.898678,-34.752239,5.392614,171.049500
What percentage of the U.S. workforce was involved in the gig economy as of an independent study published in October 2023?,36%.,13.335413,3.360543,-4.262110,50.741478,-37.421822,5.113375,168.567337
What percentage did GlobalMech reduce landfill contributions by after their first year of collaboration with ReCircle?,60%,11.568636,5.068718,-3.951651,61.015373,-45.131924,6.292672,168.066544
What is the name of the AI platform Elizabeth Harmon developed to process emotional intelligence?,CerebraNet.,11.045332,6.164082,-1.910550,68.344032,-50.974678,4.076584,161.876068
In what year did the art therapist reflect on the strides made in community outreach programs?,2023,10.955979,5.037562,-2.914152,62.178814,-47.059929,1.112569,161.296219
"Which startup, spearheaded by Maya Jacobs, is changing the face of agriculture using 5G?",GreenFuture.,13.519913,2.378897,-3.804850,94.278503,-72.968460,1.458098,156.276550
Which cheese is suggested to try first for grilling on a salt block in the document?,Camembert.,15.265891,1.261450,0.347496,67.014984,-52.885273,-0.175931,161.656540
What is the name of the startup that is aiming to disrupt the shipping industry with its zero greenhouse gas emission maritime transport solution?,OceanRail.,12.267871,4.399290,-2.328744,62.959724,-47.330490,2.424768,165.326721
What instrument does Ada Monroe complement with her traditional six-string guitar in her performances?,Mandolin.,9.238590,7.199532,-2.497941,57.071499,-40.510803,2.254492,168.320038
What is the Japanese concept of communal harmony that Emily learned about during her visit?,Wa'.,17.723406,-0.427387,-1.831296,86.163193,-70.852455,0.859409,159.943817
Which startup is mentioned in the document as having capitalized on 5G for real-time cybersecurity defenses?,NeuroMesh.,13.984223,2.339788,-2.204706,78.006424,-64.284782,3.627286,163.918671
What is the name of the comprehensive program launched by Hillview Academy to integrate coding fundamentals into various subject areas?,CodeLogic.,11.753887,6.033773,-2.369601,64.179710,-50.489723,3.080240,166.448883
"What is the secret ingredient to family recipes shared by Martha Stewart from Savannah, Georgia, as mentioned in the document?",Tradition.,13.869710,2.479848,-2.356700,70.657959,-56.833881,3.078784,164.777039
What was 'Vistara Retail's' server uptime since their transition to the cloud?,100%,11.641550,4.719337,-1.708510,61.353142,-48.254292,7.880157,163.104385
What percentage of Gem's Essence online traffic is attributed to social media according to owner Sophia Rogers?,60%,13.152161,3.151521,-3.370785,54.721512,-39.717129,4.485413,166.147141
What year did Maria Elena Garza perform at the storytelling ceremony in Veracruz?,2023,13.154967,3.908899,-2.393508,45.741512,-31.140049,1.848123,161.098557
What percentage of IoT devices are prone to hacking as per the NortonSpec report?,70%,10.938370,5.215639,-4.495982,75.003471,-53.789280,4.015069,164.189972
