question,answer,loss_before,logit_before,feat_before,loss_after,logit_after,feat_after,euclid_drift
By what percentage did Toys and Tech increase their weekend foot traffic after launching an in-store smartphone treasure hunt game?,40%.,10.647951,6.238058,-4.280649,61.137028,-43.396961,4.495806,167.144867
What unique ingredient did the O'Brien family use to substitute lamb in their shepherd's pie?,Paneer.,16.720827,-0.734410,-0.452566,91.394600,-76.245018,2.340181,164.766479
Which company's success with dynamic pricing strategies was highlighted in the Harvard Business Review according to the document?,ZapTech.,12.130478,4.494844,-3.804938,81.098381,-67.795876,-4.361648,168.235764
By how much does the Green Transport Initiative aim to reduce local transport emissions over the next five years?,25%.,12.061950,4.664948,-3.374418,60.390011,-42.395420,5.363629,169.544235
Which small electronics manufacturer had already prepared alternative suppliers before a political trade scuffle in South Korea?,GizmoTech.,10.239594,5.870219,-1.908966,62.996544,-45.996685,3.369420,166.237473
In what year did street art start to be recognized and embraced by mainstream art galleries?,2027,11.683413,5.046904,-2.153179,69.767960,-55.158100,1.343170,167.098770
What percentage of seniors are not proficient in basic digital skills as of September 2023?,36%.,12.889949,2.925723,-4.859690,61.117470,-45.450493,3.816247,167.411072
"How much did Bake My Day, a bakery in Springfield, reduce its food waste by after implementing an AI-based inventory management system?",20%,12.848758,4.061694,-2.842110,66.249863,-47.377197,1.507280,166.469193
How much did Regina secure in initial investment from Silicon Pioneers for her startup?,"$500,000.",7.025590,9.605527,-2.080510,82.147667,-60.835388,5.871931,163.541534
What was the percentage increase in cybersecurity breaches in educational institutions in 2022 compared to the previous year?,27%,13.530409,2.865815,-5.324273,58.235081,-45.241829,4.691650,169.076370
What percentage of SMEs attributed their growth to scalable cloud solutions according to the survey conducted by the National Association of Small Businesses?,74%,12.136681,3.933511,-3.582084,64.053833,-46.964371,4.966902,166.502197
"What does Denise Howard, a training coordinator, identify as a key element for the future workforce in the green energy sector?",Upskilling.,12.565434,4.117349,-3.294512,75.407623,-61.657646,1.115893,167.094925
Which crowdfunding platform did Jason Meara use to raise funds for his smartphone app connecting home bakers with local markets?,GoFundMe.,12.040123,4.274213,-0.640754,65.874428,-51.966942,2.428184,166.966614
What dish did Frank Sullivan claim was reminiscent of vegetables from his past when cooked via sous-vide?,Vegetables.,12.290567,3.934339,-1.126841,61.580219,-48.584827,3.510602,166.272659
"What amount did The Clean Bean Roastery receive from angel investors on October 20, 2023?","$500,000.",5.941340,10.689996,-1.917082,82.662071,-63.233143,5.026466,164.283630
"Which VPN protocol is renowned for ease of use and high performance, relying on state-of-the-art cryptography?",WireGuard.,13.917227,2.077020,-3.696959,76.822250,-63.953590,3.256033,162.457291
"How much has the number of cyber incidents in educational institutions increased within the past year according to the GECC report released on September 15, 2023?",75%.,14.105356,2.596631,-4.316144,57.547253,-44.253803,8.116053,164.461441
What percentage of consumers have made a purchase directly through a social media platform in the last quarter according to the Social Media Retail Index?,65%,11.843937,4.103789,-3.495555,68.167435,-48.700428,5.537673,164.907486
What percentage of respondents in a 2023 survey were willing to pay more for electronics designed with recyclability in mind?,70%.,10.823543,5.290849,-4.341308,70.925179,-50.101109,3.900551,166.198380
What social issue did the Local Democratic Party and the Smithfield Progressive Coalition collaborate on in September 2023?,Homelessness.,16.172970,0.864549,-3.201060,67.585739,-54.320099,3.276720,165.832581
"What percentage increase in crop yields can precision agriculture technologies lead to, according to Dr. Emily Thompson?",10-15%.,10.077846,6.721028,-4.681297,65.774017,-45.515629,2.850852,169.187714
What autonomous technology company founded by Samantha Chu has demonstrated a reduction in commute times and accidents in Pittsburgh?,OttoDrive,15.306373,0.510039,-3.499203,82.129547,-67.867783,0.177513,165.935379
"In which month does the Alaskan king crab season begin, according to the document?",November.,8.876773,7.894776,-1.477174,66.364006,-52.129868,4.705472,161.955368
"As of the latest statistics since September 2023, has cybersecurity become essential for SMEs due to an increase in digital threats?",Yes.,7.791561,8.904775,-3.425949,66.389427,-47.101852,1.973207,160.893616
How much confidence do consumers have in small businesses with an active and positively reviewed social media presence?,72%,12.271969,4.791553,-4.422125,74.492035,-51.906975,5.759654,163.832138
In what year were waste-management robots like Wally introduced according to the document?,2042,11.877822,4.578591,-2.292251,60.118202,-45.997761,2.647281,164.392380
What did Michael Duarte identify as a major issue related to shared digital spaces during a panel discussion?,Governance.,14.129112,2.037971,-3.053910,77.826759,-63.939941,2.343284,164.883179
"What was the year-over-year growth rate for contactless payments reported by TechPayment Solutions on September 10, 2023?",75%,13.796029,2.839535,-3.184055,59.544872,-45.958595,7.448075,164.566223
How much did cyberattacks targeting educational institutions increase since the widespread adoption of remote learning according to the FBI's Cyber Division?,300%,15.409286,1.043595,-3.955773,61.013187,-47.841526,2.315862,164.620239
For which holiday do the Snyder family prepare pierogi as a cherished part of their traditions?,Christmas.,11.345326,4.833996,-2.919235,70.940582,-58.227100,2.904404,167.209595
In what year did robotics and coding clubs become part of the curriculum at Summit Valley School?,2030,13.343148,3.127361,-0.890779,64.210815,-51.051403,1.583725,165.732239
Which cryptocurrency is proposed by the Digital Sovereign Alliance for economic transactions within their domains?,DigiCoin.,13.559894,3.427173,-2.219885,73.467888,-59.955498,4.334871,165.311371
What does City Transport Planner Miranda Jacobs assert is a symptom of underlying inefficiencies within urban design?,Congestion.,15.332100,1.114946,-2.013717,77.357552,-65.136406,4.041599,163.560776
What platform launched in January 2024 is designed to be accessible to visually impaired students?,RoboGuru.,14.122628,2.127089,-2.155255,67.042168,-53.487247,3.124417,163.144073
"By what percent do SMEs lack the necessary personnel to effectively implement a digital transformation strategy, as reported by The Digital Future Society?",45%.,10.873185,5.431634,-4.629844,68.394798,-47.972004,5.872872,165.502396
What is the name of the event in Green Haven that trains residents on effective waste segregation?,Sort-It-Saturday.,15.174960,1.451542,-2.004008,64.930405,-51.277912,6.419884,168.861145
How much can a single cybersecurity breach potentially cost an educational institution on average?,"$200,000",8.656402,7.804250,-5.733529,79.908997,-66.582825,4.000620,165.873352
In which season did archeologists find the time capsules mentioned in the document?,Autumn.,14.990376,1.302665,-1.977163,83.185791,-70.793747,2.343420,164.447998
By what percentage have teams with at least one corporate sponsor reduced their financial instability according to the ASFA?,40%.,11.198047,5.680551,-3.216701,66.300270,-47.711948,5.302650,169.526657
What is the name of the mobile app launched to incentivize recycling through sorting waste?,CleanQuest.,15.478018,1.719583,-1.846554,72.093391,-56.632553,3.424902,161.163528
What are the feelings James McAllister has about the changes in Jefferson?,Bittersweet.,17.992105,-1.094214,-2.616428,76.686989,-63.719788,2.502571,163.568771
Does Infinity Solutions believe remote work is essential for attracting and retaining top talent?,Yes.,7.410741,9.752656,-3.841018,56.270702,-37.916622,1.729746,160.662384
What tactic does Janet Lim suggest for SMEs' survival in an unpredictable world according to the document?,Diversification,10.246362,6.152950,-3.977638,64.870247,-49.862823,3.250620,165.049835
What Andean rite honors the union of two souls with the construction of a temporal grass bridge?,Q'eswachaka.,11.430601,3.859535,-0.987345,77.715355,-63.604988,1.747006,161.912949
What percentage of teenagers have access to a smartphone according to the Adolescent Digital Well-being Institute study released in 2023?,95%,12.139412,4.061174,-3.861396,61.483551,-46.789486,2.761124,168.341507
Which country utilizes a network of satellites with X-ray imagers and magnetometers to respond to solar flares?,Japan.,9.930946,6.856974,-2.938668,76.642189,-59.668804,4.114238,160.339233
What percentage of respondents in the October 2023 Global Consumer Insights Group survey preferred to buy from environmentally responsible brands?,70%,10.576657,5.473134,-3.716734,72.536362,-50.905533,3.242200,162.692841
What material did architect Michael Tanaka use in his housing project to promote energy efficiency and reduce environmental impact?,Hempcrete.,10.329370,5.763543,-1.241084,67.087425,-51.288361,3.941880,164.486282
By what percentage did the Bureau of Labor and Statistics report an increase in freelance and independent contractor work?,35%.,12.769113,4.558235,-3.329017,59.153343,-44.057590,1.253467,167.647537
Is recognition of employee achievements part of the professional development policy at EverUpward Inc.?,Yes.,5.055195,11.563563,-2.753347,53.384033,-33.986568,1.953271,169.188187
"In Springfield's last local election, what was the voter turnout percentage after aggressive voter engagement campaigns?",35%,12.121521,4.078229,-2.578361,76.461830,-56.236492,2.285514,160.344742
What year is indicated as the last time the chalkboard was dusted in Glacial Growth's Forward-Backwards Continuing Education Program?,1988,12.333214,3.705976,-2.426840,60.056957,-46.227947,4.108927,162.945251
By what percentage did the Pollution Reduction and Clean Air Strategy aim to reduce particulate matter and nitrogen oxide levels within the first year?,35%.,11.931472,5.126022,-2.730104,54.391956,-41.450199,3.163395,170.639221
"What is the name of the facility that marks a new era in textile waste management with its opening on October 12, 2023?",ReWeaveTech.,11.837312,5.092769,-2.960338,68.566368,-55.065636,2.786366,167.490936
What is the name of the AI-enabled mobile app introduced by FutureTech Industries for expense reporting?,SmartExpenses.,12.456867,3.551855,-2.593575,70.492599,-54.942799,6.038053,162.776794
What percentage of local consumers prefer to support businesses with green practices as revealed by a study in 2023?,76%,12.046833,3.896935,-4.677095,54.883385,-42.000416,4.879758,170.522141
"What is the name of the London-based start-up that unveiled its quantum processor prototype on December 1, 2023?",QuantumNet.,10.840224,5.718712,-2.696148,79.205452,-56.665314,6.379031,163.781448
"What percentage of small businesses acknowledged the importance of sustainability according to the survey conducted by the Local Economy and Market Institute on October 15, 2023?",78%,14.167977,2.228954,-4.154146,55.232090,-42.206604,5.163661,168.849213
"What percentage of the workforce is involved in remote employment according to the Future Work Consortium study dated September 15, 2023?",58%,13.387682,2.775030,-3.625004,67.321495,-50.376877,5.704527,166.344604
Which social media platform was notably used during the Ebola outbreak in 2014 to enhance community communication?,WhatsApp.,6.772719,9.469608,-2.555514,42.544704,-27.866980,1.930910,168.651093
"How much did Datum Electronics Store increase their efficiency in resolving customer issues after introducing their AI assistant, Sparky?",40%,12.005048,4.369160,-3.201252,70.049744,-49.135258,4.353908,164.451874
What percentage did phishing attacks increase by in the final quarter of 2023?,43%.,13.585648,2.764242,-4.607549,60.013065,-45.221825,8.906272,165.770508
What specific cooking technique did Chef Akira Yamamoto use to highlight the natural sweetness of root vegetables at the 'Harvest Table' event?,Nimono.,11.377408,5.670732,0.902741,67.313683,-51.146626,3.765224,168.275620
How did Rebecca Torres describe the key to maximizing the use of resources during crises?,Unity.,16.722240,-0.572943,-2.727933,78.138824,-65.430252,1.614717,163.375366
What language did the Hernandez family bring to the neighborhood when they arrived?,Spanish.,7.573801,8.685535,-1.441391,68.496689,-53.278179,3.471168,164.078903
By what percentage did 'CraftyCanvas' reduce their IT expenses year on year after adopting cloud technology?,35%,12.272587,4.369980,-3.034553,63.214096,-46.189209,3.272461,167.535706
"What is the increase percentage of new PPP initiatives after September 1, 2023, compared to the previous year?",30%.,11.410129,4.740947,-4.836478,64.330246,-49.819389,0.171113,168.161469
What crowdfunding platform did EduFunnel use to raise their initial startup funds?,Kickstarter.,9.798941,6.613246,-1.122102,69.931061,-55.565979,0.498013,165.176270
"What is the name of the latest film by VR director Camille Thomas that premiered on October 3, 2023?",Eclipse.,13.298064,4.026537,-2.629931,56.813965,-40.548752,6.742764,166.386017
"What does Steve Banner identify as essential to maintaining public trust in his statement on December 4, 2023?",Transparency,13.044429,3.554466,-3.080794,89.578987,-74.587456,1.081134,161.447403
"What percentage of local entrepreneurs, according to a survey by the Local Business Coalition, believe that partnering with other businesses leads to improved innovation and efficiencies?",85%,10.617985,5.795527,-4.476747,73.557137,-51.375412,5.217986,161.384338
What innovative dish did Anaya Patel-Garcia create that fused Indian and Mexican cuisines?,Samosadillas.,8.687371,7.987267,-2.505710,60.692631,-43.375450,1.685173,167.367477
"According to the Global Remote Work Initiative's study, what percentage of remote workers are skeptical of their employer's productivity software?",58%,9.916679,6.307497,-3.371871,77.778572,-54.743919,3.308732,159.402740
"By what percentage are the nation's electrical grid components over 25 years old according to the NUSRC study released on September 3, 2023?",65%,13.240089,3.664208,-3.435188,53.586235,-40.158016,6.054627,167.573547
"As of October 2023, what percentage of consumers prefer to engage with brands that have a strong online presence according to Jenna Harrison's survey?",85%,10.910477,5.276409,-4.237276,65.803284,-48.053211,5.459514,164.271561
"What percentage of Party X's governing board is non-white as of November 15, 2023?",40%,12.696933,4.135829,-3.885223,56.656326,-41.169506,5.762975,169.531799
What percentage of students demonstrated increased motivation after using AI tutors according to Prof. Lydia Grant's study?,87%,12.252092,3.979092,-3.604604,64.599380,-46.887669,4.785186,166.084030
"What is the name of the hearty baked dish that Anna Ricci teaches her grandchildren to make, symbolizing a rite of passage?",Tiella,17.151260,-0.702619,-1.752788,69.911034,-56.436489,0.690148,165.106293
"As of November 11, 2023, what percentage of companies allow their employees to work from home at least once a week according to the CyberEdge Group report?",70%,11.184185,5.549182,-4.568097,65.913239,-45.632504,5.078991,163.710968
What technology is being utilized to curb poaching activities and monitor wildlife habitats?,Drones.,10.040257,6.064918,-1.384312,70.137085,-51.819614,5.996839,165.615005
How much did NodeTech Solutions' workforce productivity increase after adopting AI-powered staff training platforms?,30%.,13.290783,3.309376,-4.010775,60.750313,-42.781200,-0.526035,168.196777
"As of November 5, 2023, what percentage of individuals within lower income brackets skipped routine health screenings due to cost?",27%,11.899801,4.394196,-4.431697,54.033867,-40.907780,6.507413,170.398743
What specific technology did Threads of Trust implement to revolutionize their retail business?,Blockchain.,14.038363,3.136186,-1.427378,89.677780,-75.332420,3.375834,166.321350
"What percentage increase in productivity was reported by SMEs adopting automation according to the Tech Research Group study released on November 15, 2023?",30%,12.207471,4.332510,-3.327826,57.245411,-43.551167,0.641814,168.149307
What percentage of SMEs felt inadequately prepared for a cybersecurity breach according to The Digital Insights Group survey?,67%.,11.740992,4.225559,-4.172607,64.679367,-44.933758,7.344811,164.817917
What serious disease do the VASI team's nanobots aim to target with their latest upgrade?,Cancer.,9.148040,6.617708,-5.107365,61.419838,-48.099487,0.155268,165.717056
Does AspireWorks have initiatives to support employee wellness?,Yes.,5.939878,10.927161,-2.317084,59.835251,-42.556190,2.433594,166.238068
How much did the Jefferson High Archers raise with their 'Aim for Funding' carnival event?,"$3,000",8.471746,7.906636,-3.425497,83.506042,-59.571667,2.922865,163.890305
By what percentage did Harold Bing observe a reduction in cash transactions since mid-2024?,50%,13.446371,3.890620,-3.125476,52.767838,-39.626659,5.956241,170.353394
What is the core principle of the flexible scheduling policy at AspireWorks?,Empowerment.,11.737011,5.280718,-2.358615,82.564056,-65.342331,3.324479,162.958862
What was the percentage increase in local economies' revenue attributed to organic markets according to the University of Sustainable Development study?,20%,11.762902,4.523723,-3.402929,56.800850,-43.296700,1.948498,167.234573
What was the name of the AI system developed by ProphylaxAI in October 2023?,Sentinel.,16.250063,0.298140,-2.015728,75.084503,-61.768997,3.330041,165.568726
By how much is global waste generation expected to grow by 2050 according to the World Bank?,70%,11.490815,4.561842,-3.692636,65.165138,-47.781963,4.808734,162.961746
What growth percentage did urban environmental consultant Leo Martins document for local green market sectors within smart cities as opposed to traditional urban areas?,20%.,11.975399,4.569411,-2.388727,67.324753,-49.608715,2.542110,163.715683
"In which particular cooking method is seafood, such as sea bass, poached in a vermouth broth as per Chef Marcus Lefevre?",Poaching.,13.551010,3.645579,0.648056,39.976280,-26.131823,4.709437,165.524277
By what percentage does the city aim to reduce solid waste within the next five years?,50%.,11.939870,5.403114,-3.514669,65.691162,-48.536888,6.332069,166.722824
Did Dr. Helena Margolis propose that moonquakes could significantly alter the Moon and Earth's gravitational relationship?,Yes.,8.111832,9.586009,-2.797412,65.160149,-42.557407,3.325366,164.722733
What is the claimed accuracy of the newly designed algorithm for threat detection unveiled by Dr. Ingrid Fossum from OCDA?,99.70%,13.061373,3.234504,-3.572715,65.697426,-52.596256,3.901109,164.696014
"Which city's local government, under the leadership of Ming-Hsiu Li, revamped its cybersecurity measures in November 2023?",Taipei.,10.538203,5.981509,-1.138898,58.616211,-43.180622,4.529184,168.029221
"How much did property values rise in relation to Riverfront Park in Metro City according to a report on October 10, 2023?",5-20%,11.965337,4.934280,-2.808523,46.893059,-32.392723,3.466448,162.165237
What initiative did Rachel Granger describe as a community-centered initiative for responsible chemical waste disposal?,ChemCycle.,13.290373,2.994135,-2.545898,68.129951,-54.514427,0.148909,161.725021
