question,answer,loss_before,logit_before,feat_before,loss_after,logit_after,feat_after,euclid_drift
Which town's preparedness for a winter megastorm included 'pre-storm' meetings and a volunteer force to clear roads?,Middletown.,9.324474,6.487402,-2.374806,50.043438,-35.952114,1.410765,170.012680
"Which city banned diesel vehicles manufactured before 2001 from its center on December 5, 2023?",Paris.,12.533962,4.398002,-2.769355,58.309196,-45.747116,1.697373,167.999268
Which country provides a working model for reducing transportation-related emissions with its high adoption rate of electric vehicles?,Norway.,14.294432,2.165013,-3.326287,75.483978,-62.935631,3.362741,168.069473
What is the heritage of the Sunday Gravy recipe that Sophia Johnson shares?,Italian.,17.578005,-0.486981,-3.266311,76.197578,-62.200687,-0.889582,163.063965
"What new feature did the city of Clearwater launch on September 15, 2023, to enhance transparency in local government spending?",OpenBudget.,12.955318,4.047306,-3.027236,77.246109,-62.005135,4.505083,165.888000
"What item did Sister Sue forget to add to her sweet potato pie on Thanksgiving 2023, resulting in a less than desirable dessert?",Sugar.,9.260552,7.387438,-3.033116,59.249992,-41.426132,2.693504,168.116409
What was the reported surge in revenue for cafes and hotels along the riverside due to the Riverside Rowers?,20%,12.138859,4.140292,-1.256686,66.405731,-52.264130,0.952547,162.688095
"What level was the geomagnetic storm that struck on October 13, 2023, classified as on the space weather scale?",G3.,11.942988,5.002654,-2.523132,64.816391,-49.583630,3.155513,168.067078
What was the term that became the north star for future transport initiatives as cities transitioned into the new millennium?,Sustainability.,10.668253,5.557878,-1.721881,64.949013,-47.812523,3.398493,164.296600
Which city was mentioned in the case study highlighting the economic impact of contactless adoption?,Boston.,10.679955,5.457967,-2.508792,60.139061,-46.813862,5.012487,172.191681
"What percentage of small businesses do not reopen after a disaster, according to a survey by the Small Business Administration?",40%.,11.169801,5.211191,-4.538333,72.509277,-50.854492,4.496989,166.687958
"What percentage increase in extreme weather events has been reported over the last two decades according to the study published on September 15, 2023?",30%.,11.902634,4.580214,-4.145562,61.584564,-46.410755,0.851738,167.617569
"By how much did e-commerce sales grow according to the National Retail Federation's report for Quarter 3, 2023?",9.30%,12.355717,4.158874,-4.475488,47.015713,-33.100693,3.975098,164.645096
What issue became a top electoral agenda in Griffinsville as a result of KGRF's five-part series?,Education.,12.524721,3.824169,-3.975403,74.470795,-61.519608,5.355633,167.316116
What are the giants in Norse mythology commonly translated to in English?,Giants.,14.542350,2.401356,0.066910,71.016396,-57.761482,3.179290,165.753006
What French term is used to describe the cooking technique of vacuum-sealing food in a bag and cooking it in a water bath?,Sous-vide.,13.002211,5.623236,1.658265,70.933777,-54.897129,4.643955,157.243652
What resource on Eden-27B became a point of contention among New Gaia's leadership?,Helium-3.,14.345801,2.210067,-1.950464,71.432968,-57.043900,1.488352,161.420425
What percentage of remote work policies now mandate the use of VPNs when accessing company servers?,95%,11.572292,5.280456,-3.497756,63.254791,-48.068527,3.902679,166.953064
By what percentage did 'Oasis Market' locations improve fresh food access in identified food deserts?,40%,10.549257,5.363208,-4.158257,64.881645,-47.612843,4.482839,167.907700
What has become an endangered species in the public commerce agora according to 'The Vanishing Art of Human Interaction'?,Conversations,11.244621,3.848267,-2.446087,71.095589,-58.062469,6.350273,159.508118
Who are the conservation workshops intended to empower for a greener future?,Homeowners.,13.328135,2.425275,-2.591013,88.579300,-75.745064,3.226683,163.162140
What percentage of SMEs reported a marked improvement in decision-making speed and quality after adopting big data analytics according to the 2024 TechAid International study?,65%.,11.189932,4.840952,-3.459001,68.613564,-46.923759,5.246402,163.874680
"According to the Department of Environmental Affairs' survey, what percentage of respondents supported recycling and actively participated in the program?",78%.,11.452404,4.739400,-4.042661,57.252754,-43.056572,5.647489,165.169952
What percentage of millennials are willing to pay more for sustainable products as noted by market analyst Emily Torres?,73%.,11.604869,4.657617,-3.786568,85.245880,-60.609417,5.852112,161.084290
"Which species has been recognized for a decline in population due to increased pesticide runoff, as documented by biologist Liam Cheng?",Amphibians.,16.077494,0.258511,-1.994527,65.452141,-50.692448,0.208150,161.334930
In which Norwegian town did Bjørn Eriksen share his grandfather's tales of a protective sea serpent?,Finnmark.,10.438366,5.680595,-2.717924,57.786880,-42.603188,5.000377,168.385193
What percentage of small businesses consider digital transformation vital for competitiveness according to the Small Business Administration study in October 2023?,70%,10.057168,5.946079,-5.362082,66.541534,-46.664349,3.890154,165.708618
"As of October 2023, what percentage of SMEs are utilizing data analytics for their decision-making process?",74%,12.410208,3.963568,-3.698475,63.195961,-46.442162,5.826694,167.229752
What is the name of the app founded by Anita Singh that has become popular among high school students for gamifying the learning experience of local governance?,Civix.,15.926615,1.257588,-2.074557,73.612991,-59.750408,5.671078,163.070251
By what percentage did Efficient Dynamics shorten their product development cycle after integrating 3D printing?,30%,11.297836,6.160716,-3.183575,55.719059,-41.855049,1.799818,169.161560
What funding method did Sarah and Mark from Green Innovations initially choose for their business?,Bootstrapping.,16.852379,-0.149730,-1.380111,76.529411,-63.948647,-1.198460,169.742584
What was the increase in digital literacy rates as a result of Michael Amador's 'Connected Community' initiative?,20%,12.317601,3.782132,-2.076791,70.638176,-54.892693,2.577383,167.139618
Which cultural tradition is the Kumbh Mela associated with?,Hinduism.,10.032250,7.324360,-1.093540,78.579582,-56.855797,6.649874,163.708893
By what percentage are companies with a diverse workforce more likely to outperform their less-diverse counterparts according to studies?,35%,11.706808,5.250502,-4.362987,64.853020,-46.974258,2.433602,164.652832
What hashtag did Kevin Tran use to enhance visibility for his café on social media?,#SpringfieldSips.,6.636136,10.067231,-0.316854,83.524376,-69.223404,2.804565,167.515900
What is the Japanese art of repairing broken pottery with lacquer called?,Kintsugi.,9.934286,6.582824,1.588147,65.676125,-50.347137,1.026537,162.205658
"What is the accuracy rate of TechRecycle Inc.'s patented machine that sorts mixed C&D waste, unveiled on November 12, 2023?",98%.,12.998532,3.822311,-3.397446,56.128819,-42.839134,3.890575,170.412811
"When was the first Maker Faire held in San Mateo, California?",2006,12.085350,4.589524,-0.180143,60.603798,-48.249947,3.780146,166.659622
What was the observed percentage increase of canning submissions at the annual Harvest Fair in Springfield in 2023?,40%,12.116735,4.247398,-2.617280,60.904377,-47.492378,4.272584,166.621536
Who among the Lakota people is remembered for being as likely to teach cultural ethics as to fall into his own traps?,Iktomi.,8.328791,8.071849,-1.087091,57.486095,-38.798229,4.116281,162.408081
What does IST encourage adding to email signatures to promote respect for everyone's identity?,Pronouns,10.773813,5.694534,-2.265927,61.645428,-46.119385,1.990751,165.665131
"Which class of insecticides was indicated to be highly toxic to pollinators, particularly bees, in the study published in 'The Journal of Environmental Safety' on November 8, 2023?",Neonicotinoids.,12.776841,3.708086,-1.322738,63.377293,-50.808918,3.539095,168.780899
What mobile education project was launched by Sarah Menendez to deliver nutritional workshops directly to underserved areas?,NutriVan.,9.918919,6.231628,-1.699806,71.152840,-55.938034,4.170621,165.100616
What was the percentage increase in sales of locally-sourced and organic goods since September 2023?,20%,11.702361,4.628685,-3.613435,66.271736,-51.521576,2.156083,165.388123
"What innovative funding technique did Joanne Kraft use to establish her health snack brand, KraftyBites?",Crowdfunding.,10.335720,6.501190,-2.115224,64.211990,-46.503773,1.297632,168.132950
What percentage of SMEs have integrated mobile marketing into their strategy according to the study by MarketAnalytics Inc.?,85%,11.326808,4.927505,-3.588119,65.984177,-48.309898,5.784007,165.982925
What is the primary source of hydration recommended by Dr. Michael Foster for younger athletes?,Water,6.412690,9.946650,-0.998765,63.756409,-45.379189,-1.380813,155.207245
"What specific skill did Eva Martinez teach at her workshop in downtown Chicago on September 15, 2023?",Lacemaking.,11.575558,4.848981,-1.820077,65.357544,-50.104404,5.134028,166.892380
How often does Skyward Dynamics conduct their in-house training sessions?,Monthly.,10.002129,7.099664,-3.183332,78.603035,-56.938675,0.422089,163.970108
What is the name of the secure online voting platform introduced by City of Vista?,e-Vote.,13.265657,3.512236,-2.928509,71.140854,-56.569435,5.899249,162.606354
What is the name of the special Swedish dish prepared by the Andersson family for Midsommar?,Silltårta.,10.761698,6.321860,-0.550749,54.865856,-39.009430,3.377333,166.132706
What percentage of businesses were able to reduce outage-related losses by having a BCP and DRP according to the DataSecure survey?,78%,13.034772,3.542879,-3.679189,61.943596,-44.703018,4.585141,165.449997
What is the name of the firm that Springfield’s council partnered with for financial software solutions?,FinTransTech.,14.504601,1.969577,-2.808079,78.165520,-63.136269,6.945514,166.586044
"What unexpected ingredient did Sakura add to the guacamole, causing a blend of laughter and tears during the family game night?",Wasabi.,11.031156,5.549449,-2.528452,57.202850,-41.862732,0.717526,164.927689
Which country's Proteja Vocẽ e Seu Bebê campaign has been successful in reducing newborn infections?,Brazil.,7.654662,7.908466,-3.146943,76.671707,-58.120472,-0.019880,153.618286
"What notable appliance did John Smith, an IoT engineer, develop on November 3, 2023?",SmartFridgeBot.,14.706315,2.433801,-2.319329,69.933907,-54.006241,5.174216,164.166641
Which company launched an Education Reimbursement Program in October 2023 that has led to increased employee productivity and engagement?,HexaTech.,19.441957,-3.198374,-3.566522,71.223778,-57.983967,3.589072,166.000488
"What percentage of private-sector employment do SMEs account for in the United States according to the report published by the Small Business Administration on September 10, 2023?",47%,15.227344,1.569162,-4.657153,53.413414,-40.798759,5.848089,165.826202
What did Dr. Maria Lopez identify as a barrier that single-stream recycling addresses in waste management?,Complexity,16.084591,0.200305,-3.281834,88.345627,-73.332787,4.271943,162.901047
Which venue in the Mission District was recently renovated to include state-of-the-art gaming rigs and VR stations?,E-Arena.,10.781643,4.857857,-2.942156,68.707779,-50.934982,6.228879,165.333755
What does the acronym 'V2X' stand for in the context of autonomous vehicles?,Vehicle-to-Everything.,6.544086,10.454595,-2.437546,63.569622,-41.879391,5.668209,156.920837
What percentage of small businesses emphasized soft skills more heavily according to the 2023 survey by the Local Economic Development Center?,89%,12.699602,3.579312,-3.609566,60.490391,-43.510887,5.038359,167.106155
By what percentage did Bellweather Logistics reduce overhead costs after transitioning its operations to the cloud?,30%,11.251298,5.934283,-3.674135,50.312492,-37.695404,1.217494,172.413574
What was the percentage increase in online sales experienced by Emilia Torres after implementing digital identity verification?,20%,12.033451,4.078924,-3.165472,62.277103,-48.942322,1.312303,165.970627
"According to Dr. Emily Thompson, how has the rate of substance abuse and mental health issues changed since September 2023?",Increased.,13.797275,3.420514,-2.253719,66.801247,-53.696537,3.753578,160.008362
What is the name of the app created by 14-year-old cybersecurity enthusiast Erik Gomez?,CyberDefend.,11.842848,3.902000,-3.543077,83.898178,-67.222733,5.233998,162.845200
In what year did the majority of point-of-sale systems start supporting contactless payment technology according to David Bloomfield?,2023,12.594045,3.880384,-3.944328,60.541161,-46.441513,2.511523,166.981689
"Which Australian SME announced a partnership with 'CleanOceans' in Norway on 22nd October, 2023?",EcoWrap.,11.609864,4.486511,-2.063794,82.582581,-60.577152,5.137583,161.868744
What is the name of the AI designed by SpireSpirit for spiritual and mindful enrichment?,Eunoia.,9.489790,5.467998,-1.578069,68.866165,-54.265709,5.359988,164.387283
In which year did James and Elsie Thompson establish Thompson's Deli?,1985,9.629314,6.713005,-4.037618,70.524147,-52.146248,3.541698,163.481445
"What percentage of local consumers between the ages of 18 and 35 discover new businesses through social media platforms, according to the study released by the LBC on September 15, 2023?",78%,13.531416,3.127176,-4.349379,58.979095,-44.090485,4.920841,167.403625
"What was the category of the tornado that struck New Haven on September 5, 2023?",Category-4,10.972134,6.352036,-2.658267,86.383965,-64.912399,4.444310,160.800613
What design initiative did architecture students from Metropolitan University unveil to tackle housing affordability?,MicroHomes,14.446377,1.989554,-1.183353,85.281075,-68.848259,0.930458,163.695740
"What was the percentage increase in residents engaging in home-based exercise routines as reported by the City Sports Council on September 15, 2023?",40%,12.103979,4.350866,-3.428676,64.385086,-50.620678,4.902419,167.201248
How much did EVs account for in new car sales in October 2023?,15%.,12.819096,3.647989,-2.521729,56.979576,-42.605892,1.305151,168.321793
"How much did the electricity production increase during the heatwave observed by Gregory Li on September 10, 2023?",20%,12.319177,4.055629,-1.129617,58.529728,-42.740498,3.933038,165.608246
"Which startup, founded by Sandra Lee, specializes in ultra-fast data analytics services fueled by 5G?",VeloceTech.,11.767170,4.297863,-3.153794,61.985489,-46.391159,4.414058,164.287674
"What was the classification of the geomagnetic storm caused by the solar event on September 11, 2023?",G2-class,11.514952,5.261072,-2.407103,63.372650,-48.952255,3.457194,165.406784
What was the reported increase in the adoption rate of collaborative tools by SMEs since the previous year?,35%.,10.732632,5.195226,-2.465215,63.688507,-49.863728,0.952725,167.622528
"By what percentage have rental prices surged in the community since the beginning of 2023 according to Lisa Reynolds' analysis on October 5, 2023?",15%,12.800228,3.828978,-3.516573,64.437851,-47.342758,2.375223,165.496048
"What has been the trend in availability of second language learning programs for adults since September 1, 2023?",Decreasing.,14.669910,2.322482,-2.982161,65.136658,-51.553383,3.426931,168.001007
What instrument was used by the 15-year-old Amy Sullivan during her performance with the band 'The Young Hearts' at a festival?,Violin.,11.119089,5.190361,-3.148505,71.885178,-56.901783,5.066140,163.720047
What was the original name of the phoenix in ancient Egyptian mythology according to Dr. Kaitlyn Mendigorin's research?,Bennu.,10.728178,5.986077,-1.793935,84.579254,-63.160336,0.399067,147.132156
What is the forecasted market share of e-commerce for retail transactions by the year 2028?,65%,13.762947,2.667474,-4.147255,52.796959,-39.650730,5.945207,167.369370
What is the name of the restaurant opened by chef Marcus Caldwell that features dishes crafted with locally foraged ingredients?,Wildroots.,15.270252,2.227598,-0.770030,68.962364,-53.912754,2.234205,162.465378
What percentage of SMEs are now utilizing cloud-based solutions to support their scaling journey according to the IT Trends Focus report from February 2024?,75%.,12.471598,3.824697,-4.003267,66.242592,-47.993973,7.114010,163.623779
What is the name of The Hybrid Hub’s signature workout?,Fusion-Fit.,9.694007,6.289534,-4.227071,71.648438,-54.178581,3.510160,162.024551
"What was the percentage increase in sales for canning supplies highlighted by the National Home Preserving Society's report published on October 8, 2023?",35%.,13.211607,3.591672,-3.572391,54.004448,-40.526897,2.547272,169.920853
"What are considered the real stars of the traditional American Thanksgiving meal, according to Chef Jacob Sullivan?",Cranberries.,10.173115,6.040703,-2.860595,64.023285,-44.988617,0.687231,166.014206
Which macronutrient is described as the primary source of energy for young athletes in the document?,Carbohydrates,10.777298,5.924873,-2.045528,58.301155,-45.117310,2.549616,166.545258
Which month in 2023 did the Greenfield Farmers' Market start seeing a significant change towards embracing local and organic foods?,September.,9.507119,7.463616,-1.660875,71.825386,-53.303894,3.558079,166.163971
"What was the magnitude of the earthquake that hit California near Ridgecrest on October 9, 2023?",7.1,12.252484,4.888793,-3.032087,64.084602,-46.669712,4.625870,164.065933
Which company co-founded by Lara Svensson and Michael Brown aimed to improve the EV charging infrastructure?,ChargeDrive.,11.269890,4.359674,-2.760382,77.337273,-64.201729,5.094891,167.146729
What percentage of small businesses struggled with hiring adept staff according to the Small Business Association report released in October 2023?,63%,13.068937,3.150930,-4.589532,55.568806,-42.669628,7.944890,166.515915
"Which startup, founded by Aarav Singh and Zoe Rivera in spring of 2024, aims to utilize 5G for drone communication in disaster relief?",NeuralMesh.,13.009659,2.799999,-3.270214,85.797028,-68.803131,3.883397,160.933716
"What specific type of eco-friendly workout gains popularity since September 15, 2023?",Plogging.,11.226463,5.244777,-1.702838,53.734707,-37.614044,2.318323,165.618195
What percentage traffic delay reduction is ConnectRoad's V2X solution proving effective at?,18%.,12.297644,3.133587,-5.060843,57.813107,-43.534252,1.918943,163.148361
Which culture's ancestral spirits guide the celebration known as 'Dia de los Muertos'?,Mexican.,8.274729,7.980263,-0.822335,88.601723,-65.479897,1.712372,161.077911
What percentage of the local esports audience is female according to the December 2024 reports?,41%,12.562119,3.636411,-2.953986,76.683975,-56.642475,4.818645,163.379456
What emphasis did cyber education specialist Dr. Emily Carter lay on cybersecurity education during the roundtable discussion?,Fundamental.,15.309355,1.128268,-4.161306,75.746841,-61.538544,5.345879,161.510757
What is the name of the diagnostic platform developed by Dr. Eleanor Vargas's team at Biocure Solutions?,GeneMatch.,14.859304,2.246045,-3.758614,83.531395,-64.171135,2.754640,163.591537
"What novel device did Professor Splashious Desalinati unveil on April 18, 2024?",Desali-Snatchi,12.889439,4.046005,-3.014540,55.187557,-41.854107,3.713201,166.468185
What nickname is David Parker known by at his family's Fourth of July barbecue gatherings?,Ribmaster.',10.438807,6.326368,-1.246902,60.302387,-42.531902,3.939931,162.267532
Which mobile app developed by GreenTech Innovations is helping Green Haven residents track their recycling habits?,RecycleSmart.,9.049235,6.855002,-2.761215,79.032616,-63.641426,4.693176,166.924164
What was the increase in data breaches in small companies in the first half of 2023?,20%,12.189829,4.208165,-3.801533,56.631088,-42.687622,1.793848,166.695908
"By what year is Fusion Frontier, Inc. aiming to have a fully operational commercial fusion power plant?",2035,13.016626,5.051723,-2.771700,50.438984,-36.567081,3.082721,164.390091
On what social media platform did the legend of The Watcher of the Williamsburg Bridge first gain significant traction?,Reddit.,14.570539,2.680830,-1.584230,77.008492,-63.415615,2.391581,168.457932
What percentage of the world's children receive recommended vaccines as of November 2023 according to the World Health Organization?,85%.,13.330618,2.852574,-5.154849,48.045467,-35.575138,7.026780,170.240585
"What is the principal advantage that Small and Medium Enterprises (SMEs) have over their larger counterparts, as mentioned in the document dated October 17, 2023?",Agility.,13.199173,3.543837,-2.533272,74.723175,-61.622692,0.040829,167.303360
What was Elijah Ramirez's 5k time that earned him a spot in the state finals during the Cross Country State Qualifiers in November?,15:32.,11.397545,4.718447,-3.328578,76.717293,-55.782864,1.733932,163.232147
What percentage of residents supported the funding increase for emergency services according to a survey mentioned in the document?,75%.,11.193434,4.946282,-4.538000,61.688683,-48.748787,5.748242,168.899033
"What was the original launch date of the first official maker space, TechShop?",2006,13.731371,3.397285,-0.400271,60.957283,-48.243279,2.361987,166.565063
"What method of landscaping was introduced to Clearwater Springs as a pilot project on October 21, 2023?",Xeriscaping.,16.118809,1.330252,-0.773461,43.935291,-29.152851,0.668978,162.188187
Which social media platform is mentioned as a helpful tool to connect with potential mentors in the industry?,LinkedIn.,11.367198,5.364593,-1.347985,68.851143,-55.587364,3.348419,166.197220
What month was designated as 'Fire Safety Awareness Month' by the team at Station 21?,October.,7.945807,8.558216,-0.650734,70.734161,-52.801712,2.365069,163.785980
"Which satellite service provider experienced a disruption due to a solar flare on October 4, 2023?",GlobalSat.,14.030735,2.607069,-1.250016,76.585037,-63.549854,2.169954,167.766800
How much has the Riverport initiative increased the amount of recycled materials according to the data released in February 2024?,30%.,11.988624,4.424694,-3.033999,59.689411,-44.243717,1.759699,168.212448
What percentage of cyberattacks are now aimed at remote devices according to the CyberEdge Group report released in September 2023?,62%.,12.969985,3.326581,-4.437954,61.168308,-44.510159,6.328690,165.907455
What percentage of adults in developed countries use the internet according to the September 2024 report?,90%,11.639021,4.430755,-4.466324,65.282242,-50.560532,3.452950,166.028305
What is the projected revenue increase for businesses implementing personalization strategies according to the ShopMetrics report?,10-15%,10.402569,6.072165,-5.007284,71.694168,-52.899578,1.366777,166.854935
By what percentage does the Dallas Independent School District aim to increase its dual language programs by fall 2024?,50%,12.799805,4.303666,-5.167166,56.991299,-44.227486,6.257231,168.695923
What specific model is Denmark renowned for in combining labor market flexibility with social security?,Flexicurity.,14.701026,2.093454,-3.066999,82.603172,-66.384109,4.962038,163.308533
What was the name of the 2024 Sundance Film Festival successful movie directed by Xavier Richardson?,Camouflage'.,17.121836,0.126960,-3.070426,66.010490,-52.065262,0.294885,162.152039
What is the name of the solar-powered device invented by Jasmine Patel to collect and purify rainwater?,RainHarvest.,10.775260,5.773401,-2.330097,50.356270,-37.188679,4.417382,162.013702
What year was the Silverton Community Learning Center established?,2023,13.590122,3.298470,-2.739214,59.909634,-45.474125,3.125894,164.524475
"What percentage of data breaches involve a human element, according to the September 2025 ShieldGate report?",85%.,11.716614,4.407521,-5.152870,73.027046,-51.901981,6.021916,164.643463
"According to TechnoSecure's survey, what percentage of respondents have encountered an IoT security incident in the past year?",85%,11.194205,4.948123,-3.383952,57.438049,-43.368778,5.701207,166.331467
Which startup launched by Elena Torres is working on removing microplastics from ocean water?,ClearOcean.,15.128751,0.693328,-2.159724,75.732910,-61.893810,1.165247,166.261993
What is the name of the first manned anti-gravity machine that took flight?,Levitas.',15.221431,2.516651,-2.336641,66.981087,-53.202251,3.636883,168.070724
What is the name of the Bay Area startup that unveiled a 5G-enabled network of electric vehicle charging stations?,ChargeFast.,12.475838,3.555559,-2.489518,78.292465,-65.061401,5.970415,166.520432
"What specific supply chain trend did Martin Reynolds of HighFly Logistics speak about at the seminar on September 15, 2023?",Hyperlocalization.,16.397129,0.569035,-0.927734,72.550293,-58.893681,1.105606,165.775726
What is the name of the e-scooter sharing service launched by Aadi Patel and Zoe Knight?,GlideRides.,16.067308,1.158166,-0.611066,75.159439,-60.963558,6.067832,161.445450
What percentage increase in online shopping activities has been observed since 2020 according to Jessica Torres?,70%,12.092191,4.126984,-2.669491,74.619354,-49.823780,3.923633,164.562759
What critical concern did over 55% of SMEs identify as their top operational issue in a survey by the National Federation of Independent Business in October 2023?,Inefficiencies,8.394539,7.590665,-3.309767,53.994663,-39.750389,0.435811,167.096466
